{
  "$schema": "../../schemas/auth-endpoint-binding.schema.json",
  "schemaVersion": "1.0",
  "key": "auth.endpoint.recovery.complete",
  "name": "Password Recovery Completion Endpoint",
  "summary": "Maps the existing reset-password endpoint to the canonical recovery completion flow handler.",
  "version": 1,
  "maturity": "implemented",
  "repository": "LagoVista/UserAdminRest",
  "projectPath": "src/LagoVista.UserAdmin.Rest",
  "sourcePath": "src/LagoVista.UserAdmin.Rest/Rest/AuthServices.cs",
  "controllerType": "PublicAuthServices",
  "methodName": "ResetPasswordAsync",
  "httpMethods": ["POST"],
  "routeTemplates": ["/api/auth/resetpassword"],
  "requestContract": "ResetPassword",
  "responseContract": "InvokeResult",
  "handlerKey": "auth.handler.recovery.complete",
  "transitionKeys": ["auth.transition.recovery.complete"],
  "projectionNotes": ["The current controller calls IPasswordManager directly; the planned refactor will preserve the route and public response while routing through AuthenticationFlowService."],
  "sourceReferences": [
    { "sourceType": "code", "reference": "LagoVista/UserAdminRest:src/LagoVista.UserAdmin.Rest/Rest/AuthServices.cs", "section": "ResetPasswordAsync" }
  ]
}
