{
  "$schema": "../../schemas/auth-endpoint-binding.schema.json",
  "schemaVersion": "1.0",
  "key": "auth.endpoint.totp-management.rotate-recovery-codes",
  "name": "TOTP Recovery Code Rotation Endpoint",
  "summary": "Maps the stable authenticated recovery-code rotation REST contract to the normalized TOTP maintenance flow boundary.",
  "version": 1,
  "maturity": "implemented",
  "repository": "LagoVista/UserAdminRest",
  "projectPath": "src/LagoVista.UserAdmin.Rest",
  "sourcePath": "src/LagoVista.UserAdmin.Rest/Rest/MfaController.cs",
  "controllerType": "MfaController",
  "methodName": "RotateRecoveryCodesAsync",
  "httpMethods": ["POST"],
  "routeTemplates": ["/api/auth/mfarecovery/rotate"],
  "requestContract": "none",
  "responseContract": "InvokeResult<List<string>>",
  "handlerKey": "auth.handler.totp-management.rotate-recovery-codes",
  "transitionKeys": ["auth.transition.totp-management.rotate-recovery-codes-success"],
  "projectionNotes": [
    "The external route and response contract are unchanged; the controller now enters through IAuthenticationFlowService.RotateTotpRecoveryCodesAsync."
  ],
  "sourceReferences": [
    { "sourceType": "code", "reference": "LagoVista/UserAdminRest:src/LagoVista.UserAdmin.Rest/Rest/MfaController.cs", "section": "MfaController.RotateRecoveryCodesAsync", "note": "Authenticated POST endpoint delegates to IAuthenticationFlowService." },
    { "sourceType": "code", "reference": "LagoVista/UserAdmin:src/LagoVista.UserAdmin/Authentication/AuthenticationFlowService.cs", "section": "RotateTotpRecoveryCodesAsync", "note": "Application front door validates the canonical transition key." }
  ]
}
