{
  "$schema": "../../schemas/auth-endpoint-binding.schema.json",
  "schemaVersion": "1.0",
  "key": "auth.endpoint.totp-enrollment.begin",
  "name": "TOTP Enrollment Begin Endpoint",
  "summary": "Maps the stable authenticated TOTP enrollment-begin REST contract to the normalized authentication flow boundary.",
  "version": 1,
  "maturity": "implemented",
  "repository": "LagoVista/UserAdminRest",
  "projectPath": "src/LagoVista.UserAdmin.Rest",
  "sourcePath": "src/LagoVista.UserAdmin.Rest/Rest/MfaController.cs",
  "controllerType": "MfaController",
  "methodName": "BeginTotpEnrollmentAsync",
  "httpMethods": ["POST"],
  "routeTemplates": ["/api/auth/mfatotp/enrollment/begin"],
  "requestContract": "none",
  "responseContract": "InvokeResult<AppUserTotpEnrollmentInfo>",
  "handlerKey": "auth.handler.totp-enrollment.begin",
  "transitionKeys": ["auth.transition.totp-enrollment.begin"],
  "sourceReferences": [
    { "sourceType": "code", "reference": "LagoVista/UserAdminRest:src/LagoVista.UserAdmin.Rest/Rest/MfaController.cs", "section": "MfaController.BeginTotpEnrollmentAsync", "note": "Authenticated endpoint delegates to IAuthenticationFlowService.BeginTotpEnrollmentAsync." }
  ]
}
